{"$id":"https://awesome-self-skills.local/schemas/v5-normative-rule-inventory.schema.json","$schema":"https://json-schema.org/draft/2020-12/schema","additionalProperties":false,"properties":{"fsm_registry_digest":{"const":"sha256:f4f17d1a386b0355225e3ea9f8a1860f8397bc8e26b4abbce32352554660d8ac"},"invariant_refs":{"items":false,"maxItems":34,"minItems":34,"prefixItems":[{"const":"SPEC.FR001"},{"const":"SPEC.FR002"},{"const":"SPEC.FR003"},{"const":"SPEC.FR004"},{"const":"SPEC.FR005"},{"const":"SPEC.FR006"},{"const":"SPEC.FR007"},{"const":"SPEC.FR008"},{"const":"SPEC.FR009"},{"const":"SPEC.FR010"},{"const":"SPEC.FR011"},{"const":"SPEC.FR012"},{"const":"SPEC.FR013"},{"const":"SPEC.FR014"},{"const":"SPEC.FR015"},{"const":"SPEC.FR016"},{"const":"SPEC.API.CREATE"},{"const":"SPEC.API.ADVANCE"},{"const":"SPEC.API.INSPECT"},{"const":"SPEC.WORKFLOW.RESUME"},{"const":"SPEC.ACTION.TOKEN"},{"const":"SPEC.REPLY"},{"const":"SPEC.OWNERSHIP"},{"const":"SPEC.CANONICAL"},{"const":"SPEC.SEMANTIC.REVIEW"},{"const":"SPEC.CLARIFICATION"},{"const":"SPEC.BEHAVIOR"},{"const":"SPEC.PROVENANCE"},{"const":"SPEC.FSM"},{"const":"SPEC.POLICY"},{"const":"SPEC.TRANSACTION"},{"const":"SPEC.RENDER"},{"const":"SPEC.FIXTURE"},{"const":"SPEC.RELEASE"}],"type":"array"},"inventory_digest":{"const":"sha256:5e27f84082fa68d3f6ae7414757b54822de46b4ce58005a2032b86d446987317"},"inventory_format_version":{"const":1},"policy_registry_digest":{"const":"sha256:274f11d16ad13304afa7ea64ebf1474ee7b8f5df79c7813f4ccd8e9f29003dd9"},"runtime_error_refs":{"items":false,"maxItems":40,"minItems":40,"prefixItems":[{"const":"SPEC.ERROR.ACCEPTED_STATE_INTEGRITY_FAILURE"},{"const":"SPEC.ERROR.ACTION_NOT_ADVERTISED"},{"const":"SPEC.ERROR.AMBIGUITY_UNRESOLVED"},{"const":"SPEC.ERROR.ANSWER_BINDING_AMBIGUOUS"},{"const":"SPEC.ERROR.ANSWER_BINDING_INVALID"},{"const":"SPEC.ERROR.ANSWER_NATURE_INVALID"},{"const":"SPEC.ERROR.ATOMIC_OUTCOME_NOT_SINGLE"},{"const":"SPEC.ERROR.CANONICAL_RENDER_MISMATCH"},{"const":"SPEC.ERROR.CASE_DOCUMENT_REFERENCE_INVALID"},{"const":"SPEC.ERROR.CLARIFICATION_CONFIRMATION_INVALID"},{"const":"SPEC.ERROR.CLARIFICATION_CONFIRMATION_REQUIRED"},{"const":"SPEC.ERROR.CLARIFICATION_IMPACT_MISMATCH"},{"const":"SPEC.ERROR.CLARIFICATION_PREVIEW_STALE"},{"const":"SPEC.ERROR.CLIENT_KEY_INVALID"},{"const":"SPEC.ERROR.COMPILER_OWNED_FIELD_SUBMITTED"},{"const":"SPEC.ERROR.COMPLEMENT_COVERAGE_OVERCLAIMED"},{"const":"SPEC.ERROR.CONTROL_ORIGIN_REQUIRED"},{"const":"SPEC.ERROR.DOMAIN_CONTRACT_REQUIRED"},{"const":"SPEC.ERROR.DOWNSTREAM_ARTIFACT_AS_SOURCE"},{"const":"SPEC.ERROR.ENTITY_RESOLUTION_UNRESOLVED"},{"const":"SPEC.ERROR.FIELD_CORRESPONDENCE_REQUIRED"},{"const":"SPEC.ERROR.IDEMPOTENCY_CONFLICT"},{"const":"SPEC.ERROR.ORACLE_NOT_DECIDABLE"},{"const":"SPEC.ERROR.ORACLE_SEMANTICS_REQUIRED"},{"const":"SPEC.ERROR.PERMISSION_MATRIX_INCOMPLETE"},{"const":"SPEC.ERROR.PERMISSION_OUTCOME_UNRESOLVED"},{"const":"SPEC.ERROR.POPULATION_CONTRACT_REQUIRED"},{"const":"SPEC.ERROR.PROVENANCE_CYCLE"},{"const":"SPEC.ERROR.PROVENANCE_EDGE_NOT_ALLOWED"},{"const":"SPEC.ERROR.QUESTION_PART_ACTION_CONFLICT"},{"const":"SPEC.ERROR.QUESTION_PART_TRANSITION_INVALID"},{"const":"SPEC.ERROR.RESUME_PARENT_INVALID"},{"const":"SPEC.ERROR.RISK_LEDGER_INVALID"},{"const":"SPEC.ERROR.RUN_ARGUMENT_INVALID"},{"const":"SPEC.ERROR.SCHEMA_VALIDATION_FAILED"},{"const":"SPEC.ERROR.SEMANTIC_REVIEW_CANDIDATE_MISSING"},{"const":"SPEC.ERROR.SEMANTIC_REVIEW_CANDIDATE_UNKNOWN"},{"const":"SPEC.ERROR.TEMPORARY_BASIS_REQUIRED"},{"const":"SPEC.ERROR.UNSUPPORTED_SCHEMA_VERSION"},{"const":"SPEC.ERROR.VALUE_STATE_INVALID"}],"type":"array"},"schema_version":{"const":"5.0.0"}},"required":["schema_version","inventory_format_version","fsm_registry_digest","policy_registry_digest","invariant_refs","runtime_error_refs","inventory_digest"],"type":"object"}
