{"fsm_registry_digest":"sha256:f4f17d1a386b0355225e3ea9f8a1860f8397bc8e26b4abbce32352554660d8ac","invariant_refs":["SPEC.FR001","SPEC.FR002","SPEC.FR003","SPEC.FR004","SPEC.FR005","SPEC.FR006","SPEC.FR007","SPEC.FR008","SPEC.FR009","SPEC.FR010","SPEC.FR011","SPEC.FR012","SPEC.FR013","SPEC.FR014","SPEC.FR015","SPEC.FR016","SPEC.API.CREATE","SPEC.API.ADVANCE","SPEC.API.INSPECT","SPEC.WORKFLOW.RESUME","SPEC.ACTION.TOKEN","SPEC.REPLY","SPEC.OWNERSHIP","SPEC.CANONICAL","SPEC.SEMANTIC.REVIEW","SPEC.CLARIFICATION","SPEC.BEHAVIOR","SPEC.PROVENANCE","SPEC.FSM","SPEC.POLICY","SPEC.TRANSACTION","SPEC.RENDER","SPEC.FIXTURE","SPEC.RELEASE"],"inventory_digest":"sha256:5e27f84082fa68d3f6ae7414757b54822de46b4ce58005a2032b86d446987317","inventory_format_version":1,"policy_registry_digest":"sha256:274f11d16ad13304afa7ea64ebf1474ee7b8f5df79c7813f4ccd8e9f29003dd9","runtime_error_refs":["SPEC.ERROR.ACCEPTED_STATE_INTEGRITY_FAILURE","SPEC.ERROR.ACTION_NOT_ADVERTISED","SPEC.ERROR.AMBIGUITY_UNRESOLVED","SPEC.ERROR.ANSWER_BINDING_AMBIGUOUS","SPEC.ERROR.ANSWER_BINDING_INVALID","SPEC.ERROR.ANSWER_NATURE_INVALID","SPEC.ERROR.ATOMIC_OUTCOME_NOT_SINGLE","SPEC.ERROR.CANONICAL_RENDER_MISMATCH","SPEC.ERROR.CASE_DOCUMENT_REFERENCE_INVALID","SPEC.ERROR.CLARIFICATION_CONFIRMATION_INVALID","SPEC.ERROR.CLARIFICATION_CONFIRMATION_REQUIRED","SPEC.ERROR.CLARIFICATION_IMPACT_MISMATCH","SPEC.ERROR.CLARIFICATION_PREVIEW_STALE","SPEC.ERROR.CLIENT_KEY_INVALID","SPEC.ERROR.COMPILER_OWNED_FIELD_SUBMITTED","SPEC.ERROR.COMPLEMENT_COVERAGE_OVERCLAIMED","SPEC.ERROR.CONTROL_ORIGIN_REQUIRED","SPEC.ERROR.DOMAIN_CONTRACT_REQUIRED","SPEC.ERROR.DOWNSTREAM_ARTIFACT_AS_SOURCE","SPEC.ERROR.ENTITY_RESOLUTION_UNRESOLVED","SPEC.ERROR.FIELD_CORRESPONDENCE_REQUIRED","SPEC.ERROR.IDEMPOTENCY_CONFLICT","SPEC.ERROR.ORACLE_NOT_DECIDABLE","SPEC.ERROR.ORACLE_SEMANTICS_REQUIRED","SPEC.ERROR.PERMISSION_MATRIX_INCOMPLETE","SPEC.ERROR.PERMISSION_OUTCOME_UNRESOLVED","SPEC.ERROR.POPULATION_CONTRACT_REQUIRED","SPEC.ERROR.PROVENANCE_CYCLE","SPEC.ERROR.PROVENANCE_EDGE_NOT_ALLOWED","SPEC.ERROR.QUESTION_PART_ACTION_CONFLICT","SPEC.ERROR.QUESTION_PART_TRANSITION_INVALID","SPEC.ERROR.RESUME_PARENT_INVALID","SPEC.ERROR.RISK_LEDGER_INVALID","SPEC.ERROR.RUN_ARGUMENT_INVALID","SPEC.ERROR.SCHEMA_VALIDATION_FAILED","SPEC.ERROR.SEMANTIC_REVIEW_CANDIDATE_MISSING","SPEC.ERROR.SEMANTIC_REVIEW_CANDIDATE_UNKNOWN","SPEC.ERROR.TEMPORARY_BASIS_REQUIRED","SPEC.ERROR.UNSUPPORTED_SCHEMA_VERSION","SPEC.ERROR.VALUE_STATE_INVALID"],"schema_version":"5.0.0"}
